{
  "schemaVersion": 1,
  "ordinal": 1,
  "riskLevel": "low",
  "id": "tycho-crater",
  "title": "Кратер Тихо",
  "description": "Учебная смена с одним коротким рискованным маршрутом через кратерное поле.",
  "tiledMap": "tycho-crater.tmj",
  "themeId": "tycho-low",
  "balanceProfileId": "default",
  "seed": "tycho-crater-safe-130",
  "shiftDurationRealSeconds": 480,
  "centers": [
    {
      "id": "selene",
      "name": "Центр Селена",
      "oxygen": {
        "initial": 92,
        "capacity": 100,
        "depletionGameMinutes": 480
      },
      "food": {
        "initial": 88,
        "capacity": 100,
        "depletionGameMinutes": 480
      },
      "equipmentInitial": 95
    },
    {
      "id": "atlas",
      "name": "Центр Атлас",
      "oxygen": {
        "initial": 88,
        "capacity": 100,
        "depletionGameMinutes": 450
      },
      "food": {
        "initial": 92,
        "capacity": 100,
        "depletionGameMinutes": 480
      },
      "equipmentInitial": 92
    }
  ],
  "facilityLayouts": [
    {
      "id": "tycho-west",
      "baseCell": { "column": 1, "row": 4 },
      "centers": {
        "selene": { "column": 9, "row": 4 },
        "atlas": { "column": 3, "row": 1 }
      }
    },
    {
      "id": "tycho-north",
      "baseCell": { "column": 5, "row": 1 },
      "centers": {
        "selene": { "column": 8, "row": 3 },
        "atlas": { "column": 1, "row": 6 }
      }
    },
    {
      "id": "tycho-south",
      "baseCell": { "column": 1, "row": 2 },
      "centers": {
        "selene": { "column": 8, "row": 4 },
        "atlas": { "column": 3, "row": 6 }
      }
    },
    {
      "id": "tycho-east",
      "baseCell": { "column": 7, "row": 2 },
      "centers": {
        "selene": { "column": 10, "row": 4 },
        "atlas": { "column": 1, "row": 6 }
      }
    }
  ],
  "rovers": [
    {
      "id": "armstrong",
      "name": "Армстронг",
      "archetypeId": "standard",
      "spawnObjectId": "spawn-armstrong"
    },
    {
      "id": "leonov",
      "name": "Леонов",
      "archetypeId": "fast",
      "spawnObjectId": "spawn-leonov"
    },
    {
      "id": "lunokhod",
      "name": "Луноход",
      "archetypeId": "repair",
      "spawnObjectId": "spawn-lunokhod"
    }
  ],
  "riskChoiceCenters": ["selene"],
  "seededEquipmentDemandCenterIds": ["selene"]
}
